{
  "brokerAuthority": false,
  "bundleSha256": "44df95b8335c7bfde33cf53bc5672df395adc5af266f8901a227ef1bc1400dec",
  "cohort": "ALL_SCOPED_INTENTS_NOT_SELECTED_CLOSED_TRADES",
  "completeTickTape": false,
  "counterfactualNet": null,
  "economicPairedReplay": false,
  "from": "2026-10-27T03:54:41.136842+00:00",
  "promotion": "HOLD",
  "prospective": false,
  "registrationSha256": null,
  "release": "0.7.3-quick-oco.1-codex.1",
  "schemaVersion": "breakout-entry-observer-1.0",
  "setups": [
    {
      "actualClosedTrades": [
        {
          "closed_at": "2026-10-27T04:17:47.114000+00:00",
          "direction": "LONG",
          "net": "53.5500000000",
          "opened_at": "2026-10-27T04:11:46.492000+00:00",
          "signed_fees": "-59.1500000000"
        }
      ],
      "actualEntries": [
        {
          "firstFill": "2026-10-27T04:11:46.492000+00:00",
          "lastFill": "2026-10-27T04:11:46.492000+00:00",
          "price": "4023.27000000000000000000",
          "side": "BUY",
          "volume": "24500.0000000000"
        }
      ],
      "candidates": [
        {
          "candidate": "TOUCH",
          "counterfactualNet": null,
          "cutoff": "2026-10-27T06:41:11.521592+00:00",
          "gtcLifetime": "UNTIL_EVIDENCE_CUTOFF_NOT_ORIGINAL_FILL",
          "m1EvidenceAvailable": true,
          "ocoRaceAmbiguous": false,
          "pathCensored": true,
          "signals": [
            {
              "confirmationAvailableAt": null,
              "counterfactualNet": null,
              "crossingProvenInObservedQuotes": true,
              "executableQuoteReference": "4023.12",
              "firstObservedAt": "2026-10-27T04:11:46.231000+00:00",
              "hypotheticalFill": null,
              "level": "4023.03",
              "observedMaximumMove": "1.36",
              "observedMinimumMove": "-1.82",
              "quoteSamples": 446,
              "side": "BUY"
            }
          ],
          "state": "OBSERVED_SIGNALS"
        },
        {
          "candidate": "BUFFER_005",
          "counterfactualNet": null,
          "cutoff": "2026-10-27T06:41:11.521592+00:00",
          "gtcLifetime": "UNTIL_EVIDENCE_CUTOFF_NOT_ORIGINAL_FILL",
          "m1EvidenceAvailable": true,
          "ocoRaceAmbiguous": false,
          "pathCensored": true,
          "signals": [
            {
              "confirmationAvailableAt": null,
              "counterfactualNet": null,
              "crossingProvenInObservedQuotes": true,
              "executableQuoteReference": "4023.12",
              "firstObservedAt": "2026-10-27T04:11:46.231000+00:00",
              "hypotheticalFill": null,
              "level": "4023.08",
              "observedMaximumMove": "1.36",
              "observedMinimumMove": "-1.82",
              "quoteSamples": 446,
              "side": "BUY"
            }
          ],
          "state": "OBSERVED_SIGNALS"
        },
        {
          "candidate": "BUFFER_010",
          "counterfactualNet": null,
          "cutoff": "2026-10-27T06:41:11.521592+00:00",
          "gtcLifetime": "UNTIL_EVIDENCE_CUTOFF_NOT_ORIGINAL_FILL",
          "m1EvidenceAvailable": true,
          "ocoRaceAmbiguous": false,
          "pathCensored": true,
          "signals": [
            {
              "confirmationAvailableAt": null,
              "counterfactualNet": null,
              "crossingProvenInObservedQuotes": true,
              "executableQuoteReference": "4023.18",
              "firstObservedAt": "2026-10-27T04:17:13.609000+00:00",
              "hypotheticalFill": null,
              "level": "4023.13",
              "observedMaximumMove": "1.30",
              "observedMinimumMove": "-0.18",
              "quoteSamples": 78,
              "side": "BUY"
            }
          ],
          "state": "OBSERVED_SIGNALS"
        },
        {
          "candidate": "BUFFER_020",
          "counterfactualNet": null,
          "cutoff": "2026-10-27T06:41:11.521592+00:00",
          "gtcLifetime": "UNTIL_EVIDENCE_CUTOFF_NOT_ORIGINAL_FILL",
          "m1EvidenceAvailable": true,
          "ocoRaceAmbiguous": false,
          "pathCensored": true,
          "signals": [
            {
              "confirmationAvailableAt": null,
              "counterfactualNet": null,
              "crossingProvenInObservedQuotes": true,
              "executableQuoteReference": "4023.24",
              "firstObservedAt": "2026-10-27T04:17:14.677000+00:00",
              "hypotheticalFill": null,
              "level": "4023.23",
              "observedMaximumMove": "1.24",
              "observedMinimumMove": "-0.24",
              "quoteSamples": 76,
              "side": "BUY"
            }
          ],
          "state": "OBSERVED_SIGNALS"
        },
        {
          "candidate": "M1_CLOSE",
          "counterfactualNet": null,
          "cutoff": "2026-10-27T06:41:11.521592+00:00",
          "gtcLifetime": "UNTIL_EVIDENCE_CUTOFF_NOT_ORIGINAL_FILL",
          "m1EvidenceAvailable": true,
          "ocoRaceAmbiguous": false,
          "pathCensored": true,
          "signals": [],
          "state": "NO_SIGNAL_OBSERVED"
        }
      ],
      "entryContext": {
        "availableAt": "2026-10-27T04:10:25.485080+00:00",
        "brokerAuthority": false,
        "capturedAt": "2026-10-27T04:10:16.558000+00:00",
        "codexDirection": "BUY",
        "completedM1Envelopes": [
          {
            "basis": "COMPLETED_M1_ENVELOPE_NOT_MODEL_SELECTED_BOX",
            "buyOffset": "0.05",
            "candles": 5,
            "lower": "4018.67",
            "sellOffset": "-2.43",
            "upper": "4022.98"
          },
          {
            "basis": "COMPLETED_M1_ENVELOPE_NOT_MODEL_SELECTED_BOX",
            "buyOffset": "0.05",
            "candles": 10,
            "lower": "4016.87",
            "sellOffset": "-4.23",
            "upper": "4022.98"
          }
        ],
        "counterfactualNet": null,
        "depthInputSha256": "c2102f4bf001cb2416099284dd76b4f4d2f25785ef77a96c6bb558a2fb9f3956",
        "depthScope": "BROKER_ONLY_NOT_GLOBAL_FLOW",
        "depthSummary": {
          "ask_levels": 4,
          "ask_liquidity_change_60s": "0",
          "bid_levels": 4,
          "bid_liquidity_change_60s": "200",
          "imbalance": "0",
          "microprice_bias": "0",
          "received_at": "2026-10-27T04:10:18.512000+00:00",
          "rolling_sample_count_60s": 100,
          "scope": "BROKER_ONLY_NOT_GLOBAL_ORDER_FLOW",
          "source_at": "2026-10-27T04:10:16.558000+00:00",
          "spread": "0.05",
          "symmetric_sizes": true,
          "timestamp_basis": "BROKER_SPOT_CLOCK_AND_LOCAL_RECEIPT",
          "warnings": [
            "SAMPLED_BROKER_DEPTH_NOT_EXECUTED_ORDER_FLOW",
            "SHALLOW_BOOK",
            "SYMMETRIC_SIZE_LADDER"
          ]
        },
        "lowerEntry": "4021.1",
        "modelSelectedBox": null,
        "movementBufferGuidance": "0.05",
        "promptSha256": "8e9afdc31d770107f2436c03e1fd4a85b8d413c92f4fbe347a3621bdc2df6324",
        "requestSha256": "361154ee94d6ac40721d9589b48ef216d8ade6da91a146834dd9dc0e93799beb",
        "roundLevelLiquidity": null,
        "roundLevels": [
          {
            "fromBuy": "-3.03",
            "fromSell": "-1.1",
            "observedCloseCrosses": 1,
            "observedM1Touches": 1,
            "price": "4020",
            "step": "5"
          },
          {
            "fromBuy": "1.97",
            "fromSell": "3.9",
            "observedCloseCrosses": 0,
            "observedM1Touches": 0,
            "price": "4025",
            "step": "5"
          },
          {
            "fromBuy": "-3.03",
            "fromSell": "-1.1",
            "observedCloseCrosses": 1,
            "observedM1Touches": 1,
            "price": "4020",
            "step": "10"
          },
          {
            "fromBuy": "6.97",
            "fromSell": "8.9",
            "observedCloseCrosses": 0,
            "observedM1Touches": 0,
            "price": "4030",
            "step": "10"
          }
        ],
        "schemaVersion": "1.0",
        "spread": "0.05",
        "state": "RECORDED",
        "tickSize": "0.01",
        "upperEntry": "4023.03"
      },
      "setup": "968450ffa720789a31a49a53",
      "sourceFiles": [
        {
          "file": "flight-968450ffa720789a31a49a53-20261027T041045132690-0000.jsonl.gz",
          "sha256": "a687e9e635e76b42858434a6d8892e372c3ca063b36c3168c72e89a84c43dbc6"
        }
      ],
      "tpAudit": {
        "counterfactualNet": null,
        "crossings": [
          {
            "brokerTp": "4023.6700000000",
            "mark": "4023.87",
            "priorProtectionObservedAt": "2026-10-27T04:17:29.365000+00:00",
            "quoteAt": "2026-10-27T04:17:30.393000+00:00",
            "receivedAt": "2026-10-27T04:17:30.553000+00:00",
            "side": "BUY"
          },
          {
            "brokerTp": "4023.6700000000",
            "mark": "4023.71",
            "priorProtectionObservedAt": "2026-10-27T04:17:31.529000+00:00",
            "quoteAt": "2026-10-27T04:17:33.679000+00:00",
            "receivedAt": "2026-10-27T04:17:33.838000+00:00",
            "side": "BUY"
          },
          {
            "brokerTp": "4023.6700000000",
            "mark": "4023.67",
            "priorProtectionObservedAt": "2026-10-27T04:17:35.526000+00:00",
            "quoteAt": "2026-10-27T04:17:36.605000+00:00",
            "receivedAt": "2026-10-27T04:17:36.766000+00:00",
            "side": "BUY"
          },
          {
            "brokerTp": "4023.6700000000",
            "mark": "4023.67",
            "priorProtectionObservedAt": "2026-10-27T04:17:37.530000+00:00",
            "quoteAt": "2026-10-27T04:17:38.400000+00:00",
            "receivedAt": "2026-10-27T04:17:38.562000+00:00",
            "side": "BUY"
          },
          {
            "brokerTp": "4023.6700000000",
            "mark": "4023.83",